{
  "schema_version": "1.0.0",
  "track_id": "KOREAN_EMOTION_ARTICULATION",
  "purpose": "한국어를 중심으로 자신의 마음과 감정을 더 정확하게 알아차리고, 비슷한 감정 사이의 차이를 구별하며, 강도·원인·관계 맥락을 고려해 자기 문장으로 표현할 수 있도록 돕는 감정 어휘 학습 지도.",
  "learning_model": [
    "먼저 지금 마음과 가장 가까운 감정 영역을 고른다.",
    "같은 영역의 가까운 표현들을 비교해 가장 맞는 말을 찾는다.",
    "감정의 강도와 원인, 관계 맥락, 몸에서 느껴지는 신호를 함께 살핀다.",
    "마지막에는 ‘나는 ___해서 ___하다’처럼 자신의 경험을 한 문장으로 표현한다.",
    "어려운 말이 쉬운 말보다 우월하다고 가르치지 않고, 상황에 더 잘 맞는 표현을 선택하는 힘을 기른다."
  ],
  "families": [
    {
      "id": "KF01",
      "label": "기쁨·즐거움",
      "question": "지금 마음이 밝고 즐거운가?",
      "description": "즐거움의 기본 감정부터 흥겨움과 강한 기쁨까지 구별한다."
    },
    {
      "id": "KF02",
      "label": "기대·설렘",
      "question": "앞으로 일어날 일이 기다려지는가?",
      "description": "미래의 좋은 일을 기다리며 생기는 설렘·기대·들뜸을 구별한다."
    },
    {
      "id": "KF03",
      "label": "만족·성취",
      "question": "해낸 일이나 결과가 마음에 차는가?",
      "description": "결과 만족, 노력의 성취감, 다른 사람을 바라보는 흐뭇함을 구별한다."
    },
    {
      "id": "KF04",
      "label": "안도·해방",
      "question": "무거웠던 걱정이나 일이 풀렸는가?",
      "description": "걱정이 사라진 안심, 막힘이 풀린 후련함, 부담이 사라진 홀가분함을 구별한다."
    },
    {
      "id": "KF05",
      "label": "평온·안정",
      "question": "마음이 조용하고 안전하게 느껴지는가?",
      "description": "편안함, 평온함, 든든함처럼 긴장이 낮아진 안정감을 표현한다."
    },
    {
      "id": "KF06",
      "label": "애정·친밀감",
      "question": "누군가를 소중하고 가깝게 느끼는가?",
      "description": "애틋함·정겨움·고마움·반가움처럼 관계에서 생기는 따뜻한 감정을 다룬다."
    },
    {
      "id": "KF07",
      "label": "그리움·마음 남음",
      "question": "떠난 사람이나 지나간 일이 자꾸 마음에 남는가?",
      "description": "그리움, 아련함, 아쉬움, 애잔함처럼 부재와 시간에 얽힌 감정을 세분화한다."
    },
    {
      "id": "KF08",
      "label": "관계의 상처",
      "question": "누군가의 말이나 태도 때문에 마음이 상했는가?",
      "description": "서운함·섭섭함·야속함처럼 관계적 기대가 어긋날 때 생기는 마음을 구별한다."
    },
    {
      "id": "KF09",
      "label": "외로움·허전함",
      "question": "마음이나 주변이 비어 있는 듯한가?",
      "description": "외로움, 쓸쓸함, 허전함, 공허함처럼 비어 있음의 결을 나눈다."
    },
    {
      "id": "KF10",
      "label": "슬픔·비애",
      "question": "마음이 가라앉거나 아픈가?",
      "description": "일상적 슬픔부터 깊은 비통함까지 슬픔의 강도와 결을 구별한다."
    },
    {
      "id": "KF11",
      "label": "실망·허탈",
      "question": "기대했던 것이 무너지거나 의미가 사라진 느낌인가?",
      "description": "실망, 허탈, 허무, 씁쓸함처럼 기대가 꺾인 뒤의 감정을 구별한다."
    },
    {
      "id": "KF12",
      "label": "걱정·불안",
      "question": "앞으로 일어날 일이 걱정되어 마음이 편치 않은가?",
      "description": "걱정·불안·조마조마함·초조함처럼 미래 지향적 불편감을 세분화한다."
    },
    {
      "id": "KF13",
      "label": "두려움·공포",
      "question": "위험하거나 무서운 일이 닥칠 것 같은가?",
      "description": "두려움의 강도와 신체 반응이 동반되는 표현을 함께 익힌다."
    },
    {
      "id": "KF14",
      "label": "답답함·막막함",
      "question": "어떻게 해야 할지 모르거나 풀리지 않는가?",
      "description": "답답함, 막막함, 갑갑함, 좌절처럼 출구가 보이지 않는 감정을 다룬다."
    },
    {
      "id": "KF15",
      "label": "분노·짜증",
      "question": "무언가가 거슬리거나 화가 나는가?",
      "description": "가벼운 짜증부터 강한 분노까지 강도와 원인을 구별한다."
    },
    {
      "id": "KF16",
      "label": "억울함·원망",
      "question": "부당하거나 야속하다고 느끼는가?",
      "description": "억울함, 원망, 분함처럼 부당성·관계적 탓·상처의 초점을 구별한다."
    },
    {
      "id": "KF17",
      "label": "부끄러움·자기의식",
      "question": "다른 사람의 시선이나 내 행동이 신경 쓰이는가?",
      "description": "부끄러움, 창피함, 민망함, 쑥스러움, 멋쩍음을 구별한다."
    },
    {
      "id": "KF18",
      "label": "미안함·후회",
      "question": "내 행동이 다른 사람이나 나 자신에게 마음에 걸리는가?",
      "description": "미안함, 죄책감, 후회, 뉘우침처럼 책임과 되돌아봄의 감정을 다룬다."
    },
    {
      "id": "KF19",
      "label": "부러움·질투",
      "question": "다른 사람이 가진 것이 마음에 걸리거나 갖고 싶은가?",
      "description": "부러움·샘·질투·시기·선망의 차이를 탐색한다."
    },
    {
      "id": "KF20",
      "label": "놀람·혼란·경이",
      "question": "예상하지 못했거나 이해하기 어려운 일이 생겼는가?",
      "description": "놀람, 당황, 어리둥절함, 신기함, 경이로움을 상황별로 나눈다."
    },
    {
      "id": "KF21",
      "label": "복합·양가감정",
      "question": "서로 다른 마음이 한꺼번에 드는가?",
      "description": "착잡함·시원섭섭함·심란함처럼 한 가지 감정으로 설명하기 어려운 상태를 다룬다."
    },
    {
      "id": "KF22",
      "label": "몸으로 치미는 감정",
      "question": "감정이 가슴·목·몸에서 먼저 느껴지는가?",
      "description": "울컥함·찡함·뭉클함·벅참처럼 신체 감각과 함께 올라오는 감정을 언어화한다."
    }
  ],
  "terms": [
    {
      "id": "KE0001",
      "expression": "기쁘다",
      "family_id": "KF01",
      "level": 1,
      "register": "everyday",
      "status": "SOURCE_VERIFIED",
      "evidence_ref": "KRD:40078",
      "note": "2026-09-21 국립국어원 한국어기초사전의 표제어·뜻풀이를 직접 확인한 기본 표현.",
      "learning_profile": {
        "lexical_depth": "BASIC",
        "school_age_evidence": "GRADE_3_6_SUPPORTED",
        "evidence_refs": [
          "KRD:40078",
          "KICCE:2026:PR2012"
        ],
        "school_age_source_form": "기쁜"
      }
    },
    {
      "id": "KE0002",
      "expression": "즐겁다",
      "family_id": "KF01",
      "level": 1,
      "register": "everyday",
      "status": "SOURCE_VERIFIED",
      "evidence_ref": "KRD:62101",
      "note": "2026-09-21 국립국어원 한국어기초사전의 표제어·뜻풀이를 직접 확인한 기본 표현.",
      "learning_profile": {
        "lexical_depth": "BASIC",
        "school_age_evidence": "GRADE_3_6_SUPPORTED",
        "evidence_refs": [
          "KRD:62101",
          "KICCE:2026:PR2012"
        ],
        "school_age_source_form": "즐거운"
      }
    },
    {
      "id": "KE0003",
      "expression": "신나다",
      "family_id": "KF01",
      "level": 1,
      "register": "everyday",
      "status": "SOURCE_VERIFIED",
      "evidence_ref": "KRD:66189",
      "note": "2026-09-21 국립국어원 한국어기초사전의 표제어·뜻풀이를 직접 확인한 기본 표현.",
      "learning_profile": {
        "lexical_depth": "BASIC",
        "school_age_evidence": "GRADE_3_6_SUPPORTED",
        "evidence_refs": [
          "KRD:66189",
          "KICCE:2026:PR2012"
        ],
        "school_age_source_form": "신나는"
      }
    },
    {
      "id": "KE0004",
      "expression": "유쾌하다",
      "family_id": "KF01",
      "level": 2,
      "register": "neutral",
      "status": "SOURCE_VERIFIED",
      "evidence_ref": "KRD:70227",
      "note": "2026-09-22 국립국어원 한국어기초사전의 정확한 표제어·뜻풀이를 직접 확인한 확장 표현.",
      "learning_profile": {
        "lexical_depth": "EXPANDED",
        "school_age_evidence": "GRADE_3_6_SUPPORTED",
        "evidence_refs": [
          "KICCE:2026:PR2012",
          "KRD:70227"
        ],
        "school_age_source_form": "유쾌한"
      }
    },
    {
      "id": "KE0005",
      "expression": "흥겹다",
      "family_id": "KF01",
      "level": 2,
      "register": "neutral",
      "status": "SOURCE_VERIFIED",
      "evidence_ref": "KRD:87537",
      "note": "2026-09-22 국립국어원 한국어기초사전의 정확한 표제어·뜻풀이를 직접 확인한 확장 표현.",
      "learning_profile": {
        "lexical_depth": "EXPANDED",
        "school_age_evidence": "LEXICAL_ONLY",
        "evidence_refs": [
          "KRD:87537"
        ],
        "school_age_source_form": null
      }
    },
    {
      "id": "KE0006",
      "expression": "행복하다",
      "family_id": "KF01",
      "level": 1,
      "register": "everyday",
      "status": "SOURCE_VERIFIED",
      "evidence_ref": "KRD:72481",
      "note": "2026-09-21 국립국어원 한국어기초사전의 표제어·뜻풀이를 직접 확인한 기본 표현.",
      "learning_profile": {
        "lexical_depth": "BASIC",
        "school_age_evidence": "GRADE_3_6_SUPPORTED",
        "evidence_refs": [
          "KRD:72481",
          "KICCE:2026:PR2012"
        ],
        "school_age_source_form": "행복한"
      }
    },
    {
      "id": "KE0007",
      "expression": "희열을 느끼다",
      "family_id": "KF01",
      "level": 3,
      "register": "formal",
      "status": "DISCOVERY_ONLY",
      "evidence_ref": null,
      "note": "의미·용례·연령 적합성 검증 전 탐색 후보.",
      "learning_profile": {
        "lexical_depth": "NUANCED",
        "school_age_evidence": "AGE_REVIEW_REQUIRED",
        "evidence_refs": [],
        "school_age_source_form": null
      }
    },
    {
      "id": "KE0008",
      "expression": "설레다",
      "family_id": "KF02",
      "level": 1,
      "register": "everyday",
      "status": "SOURCE_VERIFIED",
      "evidence_ref": "KRD:62645",
      "note": "2026-09-21 국립국어원 한국어기초사전의 표제어·뜻풀이를 직접 확인한 표현.",
      "learning_profile": {
        "lexical_depth": "BASIC",
        "school_age_evidence": "GRADE_3_6_SUPPORTED",
        "evidence_refs": [
          "KRD:62645",
          "KICCE:2026:PR2012"
        ],
        "school_age_source_form": "설레는"
      }
    },
    {
      "id": "KE0009",
      "expression": "기대되다",
      "family_id": "KF02",
      "level": 1,
      "register": "everyday",
      "status": "SOURCE_VERIFIED",
      "evidence_ref": "KRD:32495",
      "note": "2026-09-21 국립국어원 한국어기초사전의 표제어·뜻풀이를 직접 확인한 표현.",
      "learning_profile": {
        "lexical_depth": "BASIC",
        "school_age_evidence": "LEXICAL_ONLY",
        "evidence_refs": [
          "KRD:32495"
        ],
        "school_age_source_form": null
      }
    },
    {
      "id": "KE0010",
      "expression": "들뜨다",
      "family_id": "KF02",
      "level": 2,
      "register": "neutral",
      "status": "SOURCE_VERIFIED",
      "evidence_ref": "KRD:49859",
      "note": "2026-09-21 국립국어원 한국어기초사전의 표제어·뜻풀이를 직접 확인한 표현.",
      "learning_profile": {
        "lexical_depth": "EXPANDED",
        "school_age_evidence": "LEXICAL_ONLY",
        "evidence_refs": [
          "KRD:49859"
        ],
        "school_age_source_form": null
      }
    },
    {
      "id": "KE0011",
      "expression": "두근거리다",
      "family_id": "KF02",
      "level": 1,
      "register": "everyday",
      "status": "SOURCE_VERIFIED",
      "evidence_ref": "KRD:48261",
      "note": "2026-09-21 국립국어원 한국어기초사전의 표제어·뜻풀이를 직접 확인한 기본 표현.",
      "learning_profile": {
        "lexical_depth": "BASIC",
        "school_age_evidence": "LEXICAL_ONLY",
        "evidence_refs": [
          "KRD:48261"
        ],
        "school_age_source_form": null
      }
    },
    {
      "id": "KE0012",
      "expression": "고대하다",
      "family_id": "KF02",
      "level": 3,
      "register": "formal",
      "status": "DISCOVERY_ONLY",
      "evidence_ref": null,
      "note": "의미·용례·연령 적합성 검증 전 탐색 후보.",
      "learning_profile": {
        "lexical_depth": "NUANCED",
        "school_age_evidence": "AGE_REVIEW_REQUIRED",